"Index","Original Thai","Source group","Flagged by","Claude score","agy score","Issue","Suggestion","Original locations"
"TH-1339","ระวัง: กำหนดขอบเขตให้ชัด และค้นด้วยคำศัพท์กับฐานข้อมูลจากมากกว่าหนึ่งศาสตร์","PowerPoint เท่านั้น","agy","4","3","คำว่า จากมากกว่าหนึ่งศาสตร์ เป็นสำนวนแปลตรงตัวดูไม่เป็นธรรมชาติ","เปลี่ยนเป็น จากหลากหลายสาขาวิชา หรือ จากมากกว่าหนึ่งสาขาวิชา","workshop/LitWise-Literature-Review-Workshop-TH.pptx#slide-25"
"TH-1347","แผนที่แหล่งค้นอย่างน้อย 4 แหล่ง พร้อมเหตุผลเลือก","PowerPoint เท่านั้น","agy","4","3","คำว่า แหล่งค้น ดูห้วนเมื่อใช้โดดๆ ในภาษาไทย","เปลี่ยนเป็น แหล่งค้นคว้า หรือ แหล่งค้นหา","workshop/LitWise-Literature-Review-Workshop-TH.pptx#slide-26"
"TH-1489","หน่วยสังเกตเป็นอิสระ หรือมีการจับคู่หรือจัดกลุ่มที่ต้องสร้างแบบจำลอง","PowerPoint เท่านั้น","agy","4","3","ขาดคำว่า 'ต่อกัน' ทำให้ความหมายทางสถิติไม่สมบูรณ์","หน่วยสังเกตเป็นอิสระต่อกัน หรือมีการจับคู่หรือจัดกลุ่มที่ต้องนำมาสร้างแบบจำลอง","workshop/LitWise-Literature-Review-Workshop-TH.pptx#slide-50"
"TH-1493","ตรวจรูปแบบข้อมูลและเศษเหลือ ไม่ใช้การทดสอบการแจกแจงปกติเพียงอย่างเดียว","PowerPoint เท่านั้น","agy","4","3","ใช้คำว่า 'เศษเหลือ' แทนศัพท์สถิติ 'ค่าส่วนเหลือ' (residuals)","ตรวจรูปแบบข้อมูลและค่าส่วนเหลือ ไม่ใช้การทดสอบการแจกแจงปกติเพียงอย่างเดียว","workshop/LitWise-Literature-Review-Workshop-TH.pptx#slide-50"
"TH-1503","เหมาะกับการใช้เมนูและงานพื้นฐาน ควรตรวจตัวเลือกของ Welch การทดสอบแบบคำนวณค่าที่แน่นอน และการวินิจฉัยแบบจำลอง","PowerPoint เท่านั้น","Claude","3","4","การทดสอบแบบคำนวณค่าที่แน่นอนแปลตรงตัวจาก exact test ฟังไม่เป็นธรรมชาติ","ใช้ การทดสอบแบบ exact (exact test) แทน","workshop/LitWise-Literature-Review-Workshop-TH.pptx#slide-51"
"TH-1519","เครื่องมือและ AI อย่างรับผิดชอบ","PowerPoint เท่านั้น","Claude","3","4","ขาดคำกริยานำหน้า อ่านเป็นวลีห้วนไม่ใช่หัวเรื่องที่สมบูรณ์","ใช้เครื่องมือและ AI อย่างรับผิดชอบ","workshop/LitWise-Literature-Review-Workshop-TH.pptx#slide-53"
"TH-1542","เอกสารเหล่านี้เปลี่ยนความโปร่งใสจากความตั้งใจให้เป็นหลักฐานการทำงาน","PowerPoint เท่านั้น","Claude","3","4","เปลี่ยนความโปร่งใสจากความตั้งใจให้เป็นหลักฐานการทำงาน เป็นสำนวนแปลตรงตัวอ่านฝืด","เอกสารเหล่านี้เปลี่ยนความโปร่งใสจากสิ่งที่ตั้งใจไว้ให้กลายเป็นหลักฐานที่จับต้องได้","workshop/LitWise-Literature-Review-Workshop-TH.pptx#slide-60"
